id,created_at,text936419341746229248,2017-12-01 02:19:03,"b'Opinion: To help pay for tax cuts, Republicans are suggesting a 1.4% excise tax on the net investment income of cer\xe2\x80\xa6 https://t.co/vO665HayyN'"
936417078369816576,2017-12-01 02:10:03,"b""Chinese activist: 'Everyone has a spy watching them. That spy is their smartphone.'\nhttps://t.co/491aMrUUqH"""
936414584818282497,2017-12-01 02:00:09,"b'Bitcoin reaches the Big Four accounting firms, as PwC accepts a virtual-currency payment\nhttps://t.co/wSouu7dzP5'"
936412055925649408,2017-12-01 01:50:06,"b""Myanmar's Rohingya crisis: the making of a humanitarian disaster\nhttps://t.co/kwaChpvAYd"""
936410297870536704,2017-12-01 01:43:07,b'A South Dakota state official said a federal agency\xe2\x80\x99s diagnosis of a recent leak in the Keystone pipeline could sig\xe2\x80\xa6 https://t.co/7ZXGqdmibY'
936407269448867840,2017-12-01 01:31:05,b'The size and sophistication of the Hwasong-15 came as a surprise to missile experts https://t.co/cMh2bbru2W'
936404252737630209,2017-12-01 01:19:06,"b'Opinion: The debt is no reason to kill tax reform, writes @KarlRove https://t.co/6LMgdgBxqp'"
936401738285879296,2017-12-01 01:09:06,b'New Jersey Sen. Bob Menendez\xe2\x80\x99s popularity has taken a beating since his federal public-corruption trial https://t.co/ODUacxnthk'
936399228024295424,2017-12-01 00:59:08,b'The Senate Banking Committee is scheduled to vote Tuesday on Jerome Powell nomination https://t.co/HFm3MnQ4LZ'
936396940107018241,2017-12-01 00:50:02,b'GM says robotaxi service could become its biggest profit-maker within a decade https://t.co/SZfMvpWmqT'
936394434194956303,2017-12-01 00:40:05,b'Argentina\xe2\x80\x99s navy ended its efforts to rescue the crew members of a submarine that went missing two weeks ago https://t.co/oJOVya4RtY'
936391926948990978,2017-12-01 00:30:07,b'More than 400 U.S. Marines will leave Syria ahead of schedule as Islamic State loses territory https://t.co/D2fd3DMd0q'
936389451542036480,2017-12-01 00:20:17,"b'How stocks, retailers, hospitals and more are reacting to the proposed tax overhaul: https://t.co/8SvKLbC61e'"
936388141577134081,2017-12-01 00:15:04,b'Trump will nominate regional bank executive Jelena McWilliams to lead the FDIC https://t.co/lRmT9onZa6'
936386899052236800,2017-12-01 00:10:08,"b'Opinion: If we love democracy, why does \xe2\x80\x9cpopulism\xe2\x80\x9d get such a bad rap? writes @rogerkimball https://t.co/ilyEB8m3P9'"
936384404250943488,2017-12-01 00:00:13,"b""Why China's tech giants have stayed silent about workers' mass evictions https://t.co/UeQsEPzwed"""
936381832236544001,2017-11-30 23:50:00,b'GE\xe2\x80\x99s lobbying effort on the Senate tax bill exemplifies the corporate race to influence final GOP plan https://t.co/JafCdHf7FI'
936379355143593984,2017-11-30 23:40:10,b'Senior officials say there is a lengthy list of White House aides and cabinet members potentially on their way out\xe2\x80\xa6 https://t.co/cNVyEeAg1p'
936379250151710720,2017-11-30 23:39:44,b'Breaking: GOP senators hit a major roadblock in their tax-cut efforts that could force them to rewrite key parts of\xe2\x80\xa6 https://t.co/IgC1dxBVSa'
936376841614577665,2017-11-30 23:30:10,b'General Electric\xe2\x80\x99s lobbying effort on the Senate tax bill exemplifies the corporate race to influence the final for\xe2\x80\xa6 https://t.co/o4p6zREvAC'
936374321639026689,2017-11-30 23:20:09,b'Opinion: China and the U.S. still haven\xe2\x80\x99t imposed the toughest sanctions on North Korea https://t.co/3GnQLbEXTj'
936371801789272064,2017-11-30 23:10:09,b'How the story of the Pentagon Papers went from script to screen at lightning speed https://t.co/BXEiY0it5S'
936369288054788096,2017-11-30 23:00:09,b'The richest 1% of households will get a 2.4% boost in after-tax income from the House bill https://t.co/gAjtGHKnfV'
936368012378206208,2017-11-30 22:55:05,b'Did you know Norton is the signature red wine grape of Missouri? https://t.co/RINw9svKzM'
936366755898937347,2017-11-30 22:50:06,b'Kroger\xe2\x80\x99s business has stabilized after a very difficult summer https://t.co/aWguGlmd78'
936364268227883010,2017-11-30 22:40:13,b'How hard is it to eradicate Excel? Software consultants share their war stories. https://t.co/WCfqdiCDuC'
936362980446474241,2017-11-30 22:35:05,b'The latest Dow index milestone--24000--is the fifth such round-number mark this year\nhttps://t.co/fjo7qMXPQ7'
936361747572838401,2017-11-30 22:30:12,b'Wholesale electricity prices are plummeting as the rise of wind and natural gas roils U.S. power markets https://t.co/3Jc7m8Sq2W'
936359231967678469,2017-11-30 22:20:12,"b'Tax rates, tax credits and foreign profits: Industries are looking at the nitty-gritty of the GOP tax bills. They d\xe2\x80\xa6 https://t.co/hu47PInwom'"
936358696363413504,2017-11-30 22:18:04,b'Opinion: Marco Rubio tries to blow up the Senate tax reform https://t.co/rp0IOLjipb'
936356697345527809,2017-11-30 22:10:07,"b'Bette Midler\xe2\x80\x99s final \xe2\x80\x98Hello, Dolly!\xe2\x80\x99 tickets will cost as much as $10,000 and benefit the Actors Fund\nhttps://t.co/2ZPPSyNQpY'"
936354182944231425,2017-11-30 22:00:08,b'How coal was dethroned as the king of American electricity\xe2\x80\x94in five charts and two maps https://t.co/3WktLclJhP'
936352917468188673,2017-11-30 21:55:06,"b""Over the Dow's last 1,000 points, 3M was in the driver's seat. But lots of other stocks went along for the ride.\nhttps://t.co/lS5IIghE6g"""
936351658296127488,2017-11-30 21:50:06,"b""Tax reforms: 'I suspect that most foreign groups doing business in the U.S. will be negatively affected' https://t.co/FZfugC4bBb"""
936350871864139778,2017-11-30 21:46:59,"b""Taylor Swift's latest album, 'Reputation,' is coming to Spotify and Pandora tomorrow\nhttps://t.co/DV9gJt9g7n"""
936349137368383488,2017-11-30 21:40:05,"b'Berlin\xe2\x80\x99s City West gets a new lease on the good life, luring luxury house-hunters https://t.co/Hu8aypopcH'"
936347247268286464,2017-11-30 21:32:34,"b'The Senate GOP tax plan pays for less than a third of its costs, and its effects fade with time, a congressional an\xe2\x80\xa6 https://t.co/3BwLCwoshu'"
936346616868626432,2017-11-30 21:30:04,b'The U.S. and its Western allies aren\xe2\x80\x99t ready to risk another civil war in Lebanon to curb Hezbollah\xe2\x80\x94unlike Riyadh https://t.co/l5t4BvtShS'
936344150995296256,2017-11-30 21:20:16,b'Sick of spaceships? Here are more than a half-dozen alternatives to the new \xe2\x80\x98Star Wars\xe2\x80\x99 movie. https://t.co/Wm9CWoIsTn'
936343342140583938,2017-11-30 21:17:03,b'Opinion: Incoming Fed leadership should make maintaining financial stability one of the central bank\xe2\x80\x99s goals https://t.co/IfrVRnKB5J'
936341827145302017,2017-11-30 21:11:02,b'\xe2\x80\x98The English have Shakespeare. The French have Moli\xc3\xa8re. And we as Americans have the Western.\xe2\x80\x99 https://t.co/6Ay3Ohv8mP'
936340139672039424,2017-11-30 21:04:20,"b'The Dow topped 24000 after a more-than-300-point day, notching another milestone in a banner year, as hopes for a t\xe2\x80\xa6 https://t.co/1L1SpsfHU4'"
936339105402769409,2017-11-30 21:00:13,b'An obscure but vital part of financial markets is making a comeback after the financial crisis\xe2\x80\x94repos https://t.co/wIbFQJgAfv'
936336546114035717,2017-11-30 20:50:03,"b'German politics may be a mess, but the economy is booming https://t.co/DRdW7FrXkz'"
936335793240657923,2017-11-30 20:47:04,"b""Stocks are at records\xe2\x80\x94but many Americans remain wary. If you've stayed out of the market, the WSJ wants to hear fro\xe2\x80\xa6 https://t.co/XXpYVFGnGA"""
936335286518329345,2017-11-30 20:45:03,"b""Jim Nabors, who died Thursday, became an instant success when he joined 'The Andy Griffith Show' as Gomer Pyle https://t.co/X0d1pMEizV"""
936334046895984647,2017-11-30 20:40:07,"b""The race to sign the Japanese Babe Ruth isn't a bidding war. It's a recruiting mission. Inside perhaps the most fas\xe2\x80\xa6 https://t.co/wV9GmcFMlz"""
936333944282284038,2017-11-30 20:39:43,b'RT @WSJCS: Paid Program for Google Chrome: How much do you really know about enterprise browser security? Find out with this short quiz. ht\xe2\x80\xa6'
936331528963022849,2017-11-30 20:30:07,"b'\xe2\x80\x98People feel we\xe2\x80\x99re victims in a really ugly political game,\xe2\x80\x99 says Ian Dixon, whose healthcare premiums will jump https://t.co/kUFtp3tYBD'"
936328998526881793,2017-11-30 20:20:04,"b""Hollywood mines society's margins for biopics about Tonya Harding and others https://t.co/wG3E3gTzwv"""
936328389329383425,2017-11-30 20:17:38,b'Opinion: What would Jesus do on tax reform? writes @DanHenninger https://t.co/g9gbRtau7u'
936327898637750279,2017-11-30 20:15:41,"b'If lawmakers don\xe2\x80\x99t act, the Congressional Budget Office said the Treasury would most likely run out of cash by late\xe2\x80\xa6 https://t.co/b1z9gyZqy7'"
936327800805576704,2017-11-30 20:15:18,b'Verizon plans to sell home internet access. Customers would likely place a box in their windows to convert wireless\xe2\x80\xa6 https://t.co/Ezqpw8VMgX'
936326481319514112,2017-11-30 20:10:03,"b'In the dead of night, a South Korean early-warning aircraft detected the first missile launch from North Korea in m\xe2\x80\xa6 https://t.co/HMubQeL8GZ'"
936326407982108673,2017-11-30 20:09:46,b'A witness testified that Turkish President Erdogan instructed two large banks to help Iran launder money\nhttps://t.co/Llg7MsMzVH'
936323996878098434,2017-11-30 20:00:11,b'Texas is a microcosm of pressures facing power generators. \xe2\x80\x98It\xe2\x80\x99s too late\xe2\x80\x99 for coal. https://t.co/qVKyotq9TM'
936321878586740736,2017-11-30 19:51:46,"b""The Trump administration has begun notifying U.S. embassies overseas about a plan to recognize Jerusalem as the 'un\xe2\x80\xa6 https://t.co/UsoVlCo8pr"""
936321444706947072,2017-11-30 19:50:03,b'The Republican plan to tax graduate-student tuition waivers could weigh on people pursuing higher degrees\nhttps://t.co/sAAO9l2Rby'
936320211795537922,2017-11-30 19:45:09,b'Support from John McCain for the Senate tax bill shrinks the list of undecided senators to five\nhttps://t.co/W4klRhwu4s'
936318923187908610,2017-11-30 19:40:01,"b""'The Shape of Water': A movie that uses the power of classic cinema to pull its disparate themes together more or l\xe2\x80\xa6 https://t.co/LC7ZYFrfSG"""
936316434988269570,2017-11-30 19:30:08,"b'Russia sits 65th in the FIFA rankings, making it the first host nation to go into a World Cup as the lowest-placed\xe2\x80\xa6 https://t.co/pWMB2J5Pib'"
936313939612356609,2017-11-30 19:20:13,"b'The Dow industrials were up more than 300 points at midafternoon, as investors bet on passage of a tax deal\nhttps://t.co/EXfoBa6QRl'"
936312064641036289,2017-11-30 19:12:46,"b'RT @erikholmwsj: At @WSJ, we are very good at breaking news. We are less talented at making hats. https://t.co/OYh0UWgWiY'"
936311408832151553,2017-11-30 19:10:10,"b'Finance pros still cling to Excel, and software consultants have the bruises to prove it https://t.co/tIA71qPgZf'"
936309126224928768,2017-11-30 19:01:06,b'Germany\xe2\x80\x99s evolving coalition talks have forced Team Macron to pivot repeatedly https://t.co/tcJN9yihaQ'
936309028891832320,2017-11-30 19:00:42,"b'\xe2\x80\x98There\xe2\x80\x99s too much stuff in the stores,\xe2\x80\x99 says Barnes &amp; Noble CEO https://t.co/soXXxIXUaW'"
936305106454220800,2017-11-30 18:45:07,"b'Bitcoin and other virtual currencies could lead to financial catastrophes akin to bank runs, a Fed official says https://t.co/JEkdWQaVsV'"
936303329684213760,2017-11-30 18:38:04,b'Radio broadcaster puts blame on ill-fated acquisitions and competition from digital streaming and web-based formats https://t.co/ax7fMQEEMv'
936302073678827522,2017-11-30 18:33:04,"b'Batteries will power the electric car, but making them is a business car companies should avoid, says @stephenwilmot https://t.co/eiZhkli8k3'"
936298849584517125,2017-11-30 18:20:15,b'Not a Star Wars geek but still want to sound culturally literate? This guide is for you https://t.co/AQEFBCw9Uu'
936295999471054848,2017-11-30 18:08:56,"b'\xe2\x80\x9cHe\xe2\x80\x99s here\xe2\x80\x94Rex is here,\xe2\x80\x9d President Trump said Thursday after a reporter asked whether he wants Mr. Tillerson to rem\xe2\x80\xa6 https://t.co/0eZvgQzqlH'"
936293854894084096,2017-11-30 18:00:25,b'A Beijing activist bought a slingshot online. Then a state security agent showed up asking questions https://t.co/bdzeAxF2u0'
936286251329650688,2017-11-30 17:30:12,b'Will you be a winner or a loser from tax overhauls? Find out here https://t.co/6gVtCn04uJ'
936286247458308096,2017-11-30 17:30:11,b'Sen. McCain\xe2\x80\x99s endorsement of GOP tax bill shrinks list of undecided senators to five as vote approaches https://t.co/uUj9NEp8rs'
936282956980727808,2017-11-30 17:17:06,b'HP Enterprise\xe2\x80\x99s new CEO won\xe2\x80\x99t be Meg Whitman 2.0. And that\xe2\x80\x99s just the way she thinks it should be https://t.co/rYrIR229t8'
936278948773859329,2017-11-30 17:01:11,b'We published a short article about the future of Excel. It poked a hornet\xe2\x80\x99s nest https://t.co/hWPLtIF6gh'
936278726471553024,2017-11-30 17:00:18,"b'Which state has the highest hidden flood risk? Take a guess. Heck, take 49 guesses. You might not get it even then https://t.co/nmBRIkM2M4'"
936278722063294464,2017-11-30 17:00:17,b'The dethroning of King Coal: How natural gas became the leading source of electricity in the U.S. https://t.co/Ith1KggVuM'
936276651347992576,2017-11-30 16:52:03,"b'\xe2\x80\x9cBreaking all ties with [North] Korea is the easiest part, but a settlement, that\xe2\x80\x99s the real question,\xe2\x80\x9d a Kremlin s\xe2\x80\xa6 https://t.co/2cXY0JNKN9'"
936276200300965896,2017-11-30 16:50:15,b'Lower food costs helped the largest U.S. supermarket chain beat forecasts https://t.co/QnDUmwx0I6'
936276198392520705,2017-11-30 16:50:15,b'The fine print in the two tax bills is raising alarm among foreign executives https://t.co/PC6tTgKUAZ'
936274128520269824,2017-11-30 16:42:02,b'Chinese activist: \xe2\x80\x9cEveryone has a spy watching them. That spy is their smartphone.\xe2\x80\x9d https://t.co/zIESCIJU1d'
936274078792425472,2017-11-30 16:41:50,"b'Today on Snapchat: Why bitcoin is going bananas, plus what you need to know about the House\xe2\x80\x99s new higher-ed bill\xe2\x80\xa6 https://t.co/OBAEPHTkEo'"
936273898303377408,2017-11-30 16:41:07,b'The VW brand expects to sell about one million electric vehicles world-wide by 2025 https://t.co/GgD1aEcZKs'
936272921458298882,2017-11-30 16:37:14,"b""Nancy Pelosi calls the allegations against Rep. John Conyers 'serious, credible and very disappointing' https://t.co/mjJ5mLv94M"""
936271112408793088,2017-11-30 16:30:02,"b'Riyadh and Washington want to curb Iran\xe2\x80\x99s clout, but the U.S. is wary of another Lebanese civil war https://t.co/pR3RaA2uRQ'"
936269876053856256,2017-11-30 16:25:08,b'A CVS-Aetna deal would create a health-care-industry behemoth selling everything from drugs to insurance https://t.co/L5hDPzelFf'
936268611068588032,2017-11-30 16:20:06,b'Top oil officials are detained in Venezuela for alleged corruption https://t.co/Q6YZwtM9in'
936266073015570432,2017-11-30 16:10:01,"b'Activist investor Carl Icahn blasts SandRidge, says poison pill \xe2\x80\x98would make a totalitarian dictator blush\xe2\x80\x99 https://t.co/XHEgAPA6eB'"
936263584660774912,2017-11-30 16:00:08,b'Bankers say the repo market has played a stabilizing role since the crisis. \xe2\x80\x98It\xe2\x80\x99s almost gone from sinner to savior\xe2\x80\x99 https://t.co/d0W81cTN6J'
936263580239966214,2017-11-30 16:00:07,"b""'Everybody understands that the government is in charge': Why China's tech giants have kept silent on mass evictions https://t.co/xRmpgaQKco"""
936263324328751104,2017-11-30 15:59:06,b'British lawmakers called on the prime minister to rescind an invitation to President Trump for a state visit https://t.co/Zij7FNxknA'
936261054480441345,2017-11-30 15:50:04,b'What crisis? Germans shrug off politics as the economy soars https://t.co/VlFGBgCZ6E'
936259064421593088,2017-11-30 15:42:10,"b""Who's helping China police its people? Tencent, Alibaba and other giant tech firms https://t.co/32zHzKoSVX"""
936258551907082240,2017-11-30 15:40:08,"b'For architects in the world of restaurant design, the home kitchen is a chance to mesh their personal aesthetic wit\xe2\x80\xa6 https://t.co/7IoBhyRN2x'"
936256022313914368,2017-11-30 15:30:05,b'Heard on the Street: Credit Suisse decides the best target is one you can hit https://t.co/0D1Bt3PtAY'
936256018325045248,2017-11-30 15:30:04,b'Charlottesville residents have written to Congress as concerns mount over rising health-insurance premiums https://t.co/6iPyKRPby8'
936252886375456768,2017-11-30 15:17:37,"b'Power Shift: Chart-by-chart, how natural gas and renewables dethroned king coal https://t.co/BGAxPkfEJe'"
936248496595795970,2017-11-30 15:00:10,b'The retail store-card industry is facing a reckoning https://t.co/Zaqu6PemRO'
936248218039484416,2017-11-30 14:59:04,"b'After mass shootings, a proposed  gun range divides a small New Hampshire town https://t.co/mKwoVlJq8E'"
936244185342119936,2017-11-30 14:43:03,b'The 10-Point: @Gerardtbaker on the corporate-rate cut and more https://t.co/ZIgZlW2W4Q \n\nSign up here:\xe2\x80\xa6 https://t.co/jstK3VPXUm'
936243364999155712,2017-11-30 14:39:47,"b'OPEC members agree to keep limiting their output through the end of 2018, providing assurance for a still strugglin\xe2\x80\xa6 https://t.co/hOfgttW0fv'"
936243099155812352,2017-11-30 14:38:44,"b'The Dow industrials pushed past 24000 for the first time, powered by continued enthusiasm over a tax revamp https://t.co/hUdhMzTSsV'"
936240950699003905,2017-11-30 14:30:11,b'Deficit hawks want tax triggers in case economic growth is slower than forecast https://t.co/oEQ8znpaVc'
936238407172411392,2017-11-30 14:20:05,b'Need an assistant at work\xe2\x80\x94even a virtual one? Amazon wants you to use Alexa to book conference rooms and meetings https://t.co/0noJykGZyR'
936235926367494144,2017-11-30 14:10:13,b'The origins of Brexit may lie in the eurozone debt crisis https://t.co/Kh13qHcfHA'
936233509672443904,2017-11-30 14:00:37,"b'With its curved facades and circular staircase in a glass tower, Holthanger once embodied cutting-edge design https://t.co/q1nGKJAE3e'"
936230848449449984,2017-11-30 13:50:03,"b'As relations with Western nations deteriorate, Moscow is turning to China for funding\nhttps://t.co/tRlwdD2L9F'"
936229271068168192,2017-11-30 13:43:47,"b'Pope mentions Rohingya crisis during his trip to Asia, but after leaving Myanmar https://t.co/jr20DfQ8Yo'"
936228340251406336,2017-11-30 13:40:05,b'The auto industry is already spending more than investors would like on the electric revolution says @stephenwilmot\xe2\x80\xa6 https://t.co/xsrJhvw0il'
936225816245166081,2017-11-30 13:30:03,b'Alphabet mulls rehoming Nest with Google as the units chase Amazon in the home-devices market https://t.co/QfPBFZNg6q'
936223328351727616,2017-11-30 13:20:10,"b'Seoul fired off missiles within six minutes of aircraft warning, but it may not respond as quickly if at war https://t.co/Q5F3OmzOeb'"
936220800012767233,2017-11-30 13:10:07,b'Wholesale electricity prices are falling near historic lows in some parts of the U.S. https://t.co/w0OdBtjiad'
936218438401392641,2017-11-30 13:00:44,"b'\xe2\x80\x98There is enough truth in these stories to make me feel embarrassed and ashamed,\xe2\x80\x99 former NBC host says https://t.co/HLGmcRXfEt'"
936218339919220736,2017-11-30 13:00:20,"b""Photos of North Korea's Hwasong-15 show a projectile whose size and sophistication surprises missile experts https://t.co/UU2yojdnyl"""
936215742646771712,2017-11-30 12:50:01,"b""What does a widening gap between policy and market interest rates mean for China's economy? https://t.co/2HFH9Iug6l"""
936213246637461505,2017-11-30 12:40:06,b'Explore common scenarios of individual tax filers under Republican overhaul plans https://t.co/1GDKKLqzRU'
936210721364463616,2017-11-30 12:30:04,"b""Pyongyang says its new Hwasong-15 missile had a 'super-large heavy warhead' https://t.co/t2AW0w8N7H"""
936210222544293888,2017-11-30 12:28:05,b'U.S. stock futures climb after gains in Europe https://t.co/CvYvhiJM0k https://t.co/X8rtLrCyIY'
936209464469966848,2017-11-30 12:25:04,b'Sears shares jump 14% in premarket trade as finance chief details plan to help struggling retailer https://t.co/BCvJKjftdf'
936208223740350464,2017-11-30 12:20:09,"b'U.S. tech companies fought for Dreamers, but their Chinese counterparts haven\xe2\x80\x99t done the same https://t.co/KuuTkhnmWZ'"
936206975112753154,2017-11-30 12:15:11,"b'Chart-by-chart, how natural gas and renewables dethroned King Coal https://t.co/AnqTaneeCv'"
936205681589407746,2017-11-30 12:10:03,b'Russia could issue about $1 billion in dim-sum bonds as early as next week https://t.co/yeJq9C6wjA'
936203233202180097,2017-11-30 12:00:19,"b'Holiday cheer is in short supply for retailers in the Amazon age, but physical stores matter \xe2\x80\x94 Heard on the Street https://t.co/Zrme5I87qF'"
936200648793645057,2017-11-30 11:50:03,b'The repo market played a role in the financial crisis. Now it\xe2\x80\x99s making a comeback \nhttps://t.co/pewzdlwQOX'
936198141098983424,2017-11-30 11:40:05,b'What foreign companies are worried about in the U.S. tax plan https://t.co/6nXufWbHg9'
936195653234982912,2017-11-30 11:30:12,b'Germany hasn\xe2\x80\x99t had this much trouble forming a government since the 1930s. Many citizens don\xe2\x80\x99t seem to care https://t.co/ln6eVCEuqA'
936193123805429761,2017-11-30 11:20:08,"b'In challenge to cable industry, Verizon plans to provide high-speed home internet next year https://t.co/92RH5JA0jj'"
936190594367606784,2017-11-30 11:10:05,"b'Saudi Arabia learned the limits of its power after an international backlash to its approach in Lebanon, say\xe2\x80\xa6 https://t.co/3rcqNaOX5P'"
936188125801525249,2017-11-30 11:00:17,"b""Consumer prices were 1.5% higher in November than a year earlier, a pickup from October's 1.4% rate of inflation https://t.co/xDoQZNbeYA"""
936185550125654016,2017-11-30 10:50:03,b'Virginia county will see the highest costs in the U.S. next year for people on health-law exchanges https://t.co/MIh856PP1T'
936183047749283842,2017-11-30 10:40:06,"b'PwC joins a small but growing list of big firms that accept digital currency payments, including Microsoft https://t.co/wsng8bUJXJ'"
936180579288141824,2017-11-30 10:30:18,b'Take an early look at the front page of The Wall Street Journal   \nhttps://t.co/5xQPDPcm8q https://t.co/Pikl2ka1wS'
936176743525896192,2017-11-30 10:15:03,"b""Oil-price recovery is about more than OPEC's deal to curb output\xe2\x80\x94see why in five charts https://t.co/pM91uPCzPV"""
936173040358084608,2017-11-30 10:00:20,"b""U.S. special counsel interviewed Trump's son-in-law Jared Kushner\xe2\x80\x94the furthest it has reached into president's circ\xe2\x80\xa6 https://t.co/SQp143DbeI"""
936171219103240192,2017-11-30 09:53:06,"b'Once-rising star is in hot water for pro-China comments, as Australia pushes laws to prevent foreign meddling https://t.co/IVQJAp3IAH'"
936169222962597888,2017-11-30 09:45:10,b'Clarkson says it refused to pay ransom and is working with cybercrime police in the U.K. \nhttps://t.co/Y7On9rIRWx'
936165465663123456,2017-11-30 09:30:14,"b""HNA's global spending spree is over and the selling is about to begin\nhttps://t.co/6h6tshNypF"""
936161654836006913,2017-11-30 09:15:06,b'Firms like Facebook are scrambling to do business in the stifling internet environment that Lu Wei shaped\nhttps://t.co/hagJdaKfhx'
936157911562313728,2017-11-30 09:00:13,b'No pope had ever visited Myanmar before \nhttps://t.co/jyZt7hkM8B'
936154108574265345,2017-11-30 08:45:07,b'Thinking of buying bitcoin? Read this first.\nhttps://t.co/4w0VM5Mq2J'
936152340096339968,2017-11-30 08:38:05,b'OPEC and other big producers are expected to extend output cuts today\xe2\x80\x94the question is for how long https://t.co/TXEewzP3pC'
936150323403677696,2017-11-30 08:30:04,b'Trump administration seeks to isolate Kim regime following a new missile test by Pyongyang that experts say can rea\xe2\x80\xa6 https://t.co/ht18zaphAw'
936147723883081728,2017-11-30 08:19:44,b'Chinese people are angry about how the government treats poor migrant workers\nhttps://t.co/kDmq0BGgHX'
936145218851803137,2017-11-30 08:09:47,b'The U.S. says China is still a nonmarket economy and it\xe2\x80\x99s right\xe2\x80\x94Heard on the Street https://t.co/YgaHMhekY8'
936141879028142080,2017-11-30 07:56:31,b'Five charts that show the range of factors that have contributed to the rise in oil prices\nhttps://t.co/kcbZIp2yDH'
936138507818586112,2017-11-30 07:43:07,b'Out of Africa: Naspers suddenly among the world\xe2\x80\x99s most valuable firms\xe2\x80\x94thanks to Tencent\nhttps://t.co/3ztV6A3VpT'
936135235837755392,2017-11-30 07:30:07,b'Chinese conglomerate HNA has been talking to bankers about disposing or exiting some foreign assets\nhttps://t.co/esZByceWhQ'
936131465594724352,2017-11-30 07:15:08,"b""Beijing's evictions have generated a groundswell of anger at the government\xe2\x80\x99s treatment of the poor\nhttps://t.co/Nz3oyWafHD"""
936129521543204864,2017-11-30 07:07:25,b'Australian government bows to pressure to investigate financial industry after string of scandals\nhttps://t.co/rBJMLb6slb'
936126258769022976,2017-11-30 06:54:27,"b'China\xe2\x80\x99s economy has shown surprising strength, confounding analysts who expected a slowdown in the year\xe2\x80\x99s final mon\xe2\x80\xa6 https://t.co/okn8jqYjtR'"
