id,created_at,text931522341485580291,2017-11-17 14:00:07,"b""Sony wants you to know its enthusiasm for innovation hasn't been curbed\nhttps://t.co/uyzqRJ8Geo"""
931520200691867648,2017-11-17 13:51:37,"b""Wells Fargo said firing its head of consumer lending didn't have anything to do with the company's sales practices https://t.co/Zcdhh0PK2S"""
931518610161504256,2017-11-17 13:45:18,"b""Elon Musk unveiled Tesla's first all-electric semitrailer truck and a $200,000 super car https://t.co/06vdBoJk1d"""
931514809626980354,2017-11-17 13:30:11,"b'Electric vehicles aren\xe2\x80\x99t yet living up to the hype, auto makers in China are finding https://t.co/M6O4GTQGqn'"
931511036380934146,2017-11-17 13:15:12,"b'Delta is trying to catch up to JetBlue in Boston, where the discount airline is market leader https://t.co/cBpgEuj7hj'"
931507271175213056,2017-11-17 13:00:14,"b""Zimbabwe's Mugabe made his first public appearance since the military takeover, adding to suspense over his future https://t.co/JgXWJmJDBD"""
931504730836230144,2017-11-17 12:50:09,b'Bitcoin touches record high after slumping more than 25% over four days https://t.co/CR5UcDOIu0'
931502213918265344,2017-11-17 12:40:08,"b'Secretive Senate ethics panel in spotlight after calls to probe Franken, Menendez, Moore  https://t.co/uaCArhKrzu'"
931499678956388352,2017-11-17 12:30:04,"b'Planned sales totaling $800 million in U.S. dollar bonds were pulled in recent days, pointing to new strains in Asi\xe2\x80\xa6 https://t.co/8GboYYR1Gk'"
931497177288978432,2017-11-17 12:20:08,"b""Peugeot CEO in an interview explains the company's plan to return to U.S. market https://t.co/slsbSzjlOR"""
931494665966313475,2017-11-17 12:10:09,b'Reddit CEO cracks down on abusive content and investigates Russian influence https://t.co/tEWIcylPOE'
931492149329387520,2017-11-17 12:00:09,"b'When it comes to standard deduction, Republicans in both House and Senate want the same thing https://t.co/gfNVN68PSU'"
931489650698530817,2017-11-17 11:50:13,b'Two weeks of frenzied talks led to the first significant bipartisan agreement to relieve small and regional lenders\xe2\x80\xa6 https://t.co/6b5aNr0XJg'
931487112121249792,2017-11-17 11:40:08,"b'To meet government requirements, auto makers in China churn out more electric cars than they can sell https://t.co/ngIwVwv8zb'"
931484580007370752,2017-11-17 11:30:04,b'Lack of progress in German coalition talks raises the specter of political deadlock https://t.co/WsdTwIxiZo'
931480822535938049,2017-11-17 11:15:08,b'Next head of Department of Health and Human Services will be handed an agency facing criticism from state officials\xe2\x80\xa6 https://t.co/24grtbaNsR'
931477039298895872,2017-11-17 11:00:06,b'France spent roughly four times as great a share of its GDP on unemployment benefits as the U.S. did in 2013. Now i\xe2\x80\xa6 https://t.co/20Bx706wZB'
931473254971265024,2017-11-17 10:45:04,b'Junk bond outflows surge following market selloff https://t.co/mPRVE1WdC7'
931469497323618310,2017-11-17 10:30:08,b'Take an early look at the front page of The Wall Street Journal   \nhttps://t.co/5xQPDPcm8q https://t.co/xCdLSENuZg'
931467216322744320,2017-11-17 10:21:04,b'Google\xe2\x80\x99s plans bigger presence in Asia as it takes on Amazon and Microsoft  https://t.co/UauFADS3l8'
931462679235002368,2017-11-17 10:03:03,b'Axios raises $20 million to fund newsroom expansion https://t.co/h3GU7GC2Xe'
931459155143077888,2017-11-17 09:49:02,b'Global equities pause after bumpy week https://t.co/zg0xTFHSJt https://t.co/5YD0xuppWe'
931458152956129280,2017-11-17 09:45:03,b'U.S. lays the groundwork to build a type of missile banned by a Cold War-era pact   https://t.co/LJocIk5iyj'
931455213646565377,2017-11-17 09:33:23,"b""Alibaba's entertainment efforts so far look like a rich kid trying to break into Hollywood\nhttps://t.co/jwMbeA89Ar"""
931450624192995329,2017-11-17 09:15:08,"b'Fed\xe2\x80\x99s communication strategy is encouraging complacency\xe2\x80\x94it\xe2\x80\x99s time to give the market a real surprise, writes\xe2\x80\xa6 https://t.co/wTVJJL0A3f'"
931449972305866752,2017-11-17 09:12:33,"b'Volkswagen and its China partners plan to roll out 40 electric-car models by 2025, at a cost of $12 billion\nhttps://t.co/Z2sWVCxWmH'"
931446835658526720,2017-11-17 09:00:05,"b'Nissan gave answers to staff taking inspection exams, according to an internal report https://t.co/JKtGFuM5hc'"
931445566483165184,2017-11-17 08:55:03,"b'Without a doubt, the message from the South is North Korea needs to sit down for talks\nhttps://t.co/9lqdf2I8DJ'"
931442081167544320,2017-11-17 08:41:12,"b""Cambodia has effectively become the world's newest one-party state\nhttps://t.co/verM5uNyf2"""
931438700948541441,2017-11-17 08:27:46,"b'U.N. council fails to renew Syria chemical-arms probe, as U.S., Russia fault each other  https://t.co/oAjM1s3wCf'"
931435523033501696,2017-11-17 08:15:08,b'Comcast joins suitors circling 21st Century Fox assets https://t.co/AicyJnXu6p'
931431931828494336,2017-11-17 08:00:52,"b""Tesla's Roadster is a $200,000 sports car that can top speeds of 250 miles an hour\nhttps://t.co/MQiIcUqQIP"""
931427624299220993,2017-11-17 07:43:45,"b'Wal-Mart still can learn a lot from Amazon, but it has the online retailer beat in one big category: profits\xe2\x80\x93\xe2\x80\x93Heard\xe2\x80\xa6 https://t.co/da50JOeHrd'"
931424124811046912,2017-11-17 07:29:51,b'Notorious Sicilian mob boss Salvatore \xe2\x80\x98Toto\xe2\x80\x99 Riina dies at age 87 https://t.co/ddtbHjh2YA https://t.co/ox0yCVDkv6'
931419745173241856,2017-11-17 07:12:26,"b""Federal Reserve governor Lael Brainard: 'Consumers should remain in control of the data they provide'\nhttps://t.co/DDB4EhASiZ"""
931416149446811648,2017-11-17 06:58:09,"b'Moody\xe2\x80\x99s India upgrade is first since 2004, but it should have waited \xe2\x80\x94 Heard on the Street https://t.co/YQvSrbxTx9'"
931412847518715904,2017-11-17 06:45:02,b'Sotheby\xe2\x80\x99s rounded out New York\xe2\x80\x99s fall auctions with a $310.2 million contemporary art sale\nhttps://t.co/gFlny2IrtW'
931408408347054080,2017-11-17 06:27:23,"b'U.K. needs willing partners outside EU to grandfather existing trade deals, writes @wsj_douglasj\nhttps://t.co/Xmpx6H7kmM'"
931404991490818048,2017-11-17 06:13:49,b'Comcast approached 21st Century Fox over acquisition interest https://t.co/5Nm4JbHuAR https://t.co/BJnfeBbDqZ'
931401495920173056,2017-11-17 05:59:55,"b'Elon Musk unveils the Tesla Semi, an all-electric truck that he says will go 500 miles on a single charge \nhttps://t.co/H4pI3XqcES'"
931397765128753157,2017-11-17 05:45:06,b'Take an early look at the front page of The Wall Street Journal   \nhttps://t.co/5xQPDPcm8q https://t.co/qFvUMzmJ6W'
931393459944067073,2017-11-17 05:27:59,b'How do you make a small fortune in Hollywood? Start with a big one and wait. \nhttps://t.co/jNEqc1Z5KG'
931389505038413824,2017-11-17 05:12:17,b'House passes GOP bill for the most far-reaching overhaul of U.S. tax system in 31 years https://t.co/LzDFQCU3O2'
931386449664135168,2017-11-17 05:00:08,"b'U.N. council fails to renew Syria chemical-arms probe, as U.S., Russia fault each other https://t.co/5lar0z6aXE'"
931382657396760576,2017-11-17 04:45:04,"b'Military, mediators hold talks with Robert Mugabe on Zimbabwe\xe2\x80\x99s future https://t.co/DtvihD3Q2Z'"
931378884880289792,2017-11-17 04:30:04,b'Ahmed Abu Khatallah is accused of leading fatal 2012 attack on U.S. mission in Libya\nhttps://t.co/m2umlOo8YL'
931375108840673280,2017-11-17 04:15:04,b'Google doesn\xe2\x80\x99t just want to be a search engine. It thinks it can be an arbiter of truth.  https://t.co/QZ4zv4ZgfH'
931374880230174720,2017-11-17 04:14:10,"b'Opinion: The GOP tax plan could raise capital gains taxes, write @MrCapitalGains and Oscar Pollock https://t.co/7GvsryOh8O'"
931371367047581696,2017-11-17 04:00:12,b'Attorney General Jeff Sessions and the Trump administration have made targeting MS-13 a priority\nhttps://t.co/rbWRO7n9dw'
931368819767078912,2017-11-17 03:50:05,b'This street-legal monster does 0-60 in 2.7 seconds and can reach top speeds of 211 mph\nhttps://t.co/J1N53tglOT'
931366304308695041,2017-11-17 03:40:05,"b'Volkswagen and its China partners plan to roll out 40 electric-car models by 2025, at a cost of $12 billion\nhttps://t.co/bEZ1zXRkWs'"
931363784194691072,2017-11-17 03:30:04,b'Opinion: The CFPB Director to follow Richard Cordray will have to rein in a rogue progressive bureaucracy https://t.co/JSAw3rkDwW'
931358756511809536,2017-11-17 03:10:06,b'Baidu is pushing further into artificial intelligence with plans to sell a line of smart-home products in China\nhttps://t.co/4F7khaI6Jn'
931356233210228737,2017-11-17 03:00:04,"b""Cambodia has effectively become the world's newest one-party state\nhttps://t.co/k1MrHTvBJG"""
931353718351716352,2017-11-17 02:50:04,b'Top congressional leaders are getting closer to a deal on raising the federal government\xe2\x80\x99s overall spending levels\xe2\x80\xa6 https://t.co/VhSAZ3fHKC'
931351234916831232,2017-11-17 02:40:12,b'Meredith has made a takeover bid for Time Inc. in the range of $17 to $20 a share\nhttps://t.co/zLvBRkduae'
931349437045268481,2017-11-17 02:33:04,"b'Opinion: Is ObamaCare killing people? A new study suggests fatal flaws, writes @FreemanWSJ https://t.co/ieTh67uLbb'"
931346193996832768,2017-11-17 02:20:10,"b'U.K. needs willing partners outside EU to grandfather existing trade deals, writes @wsj_douglasj\nhttps://t.co/9rajVQTv7m'"
931343898680717312,2017-11-17 02:11:03,b'Without a doubt. the message from the South is North Korea needs to sit down for talks https://t.co/AV9f0sfjLZ'
931341158244110336,2017-11-17 02:00:10,b'Mueller issued subpoena for Russia-related documents from Trump campaign officials https://t.co/QhGdZsqzWC'
931338621365510146,2017-11-17 01:50:05,"b'Sitting in front of a computer may be bad for your health, but it\xe2\x80\x99s great for your paycheck https://t.co/gL5ZRQU0c6'"
931336375701590016,2017-11-17 01:41:10,"b'Opinion: Differences between the House and Senate tax reform plans could be used to improve the final bill, writes\xe2\x80\xa6 https://t.co/l80P3UO71t'"
931333622560198656,2017-11-17 01:30:13,"b'College football should respect the Wisconsin Badgers, says @jasongay https://t.co/0aKOO8x5Nt'"
931331328355831809,2017-11-17 01:21:06,b'Investors who hold insurance-like derivatives against a Venezuelan default will receive a payout of more than $1 bi\xe2\x80\xa6 https://t.co/Dv5EyM3eKR'
931328791502249984,2017-11-17 01:11:01,b'The real question is whether Alibaba should be in the entertainment business at all https://t.co/axCrnBnoIw'
931326060431585280,2017-11-17 01:00:10,b'Democrat Doug Jones is gaining traction with an under-the-radar campaign against Roy Moore https://t.co/pOjMVYpDym'
931323511980818433,2017-11-17 00:50:03,"b'Tougher legal standards, lack of \xe2\x80\x99smoking gun\xe2\x80\x99 likely undermined Menendez case https://t.co/BIrpgjpslF'"
931321252773371904,2017-11-17 00:41:04,"b'Opinion: An energy researcher sues another over a critical paper. It\xe2\x80\x99s the wrong way to resolve such disputes, writ\xe2\x80\xa6 https://t.co/bjq5QONuWL'"
931318747599601664,2017-11-17 00:31:07,b'A bipartisan Senate effort is pushing to tighten national gun-purchase background checks https://t.co/lCpLGTlVSJ'
931315996203159552,2017-11-17 00:20:11,b'Mistrial declared after jury can\xe2\x80\x99t reach verdict in corruption case of ex-NYC union boss https://t.co/aXxh2d39vi'
931313460532695040,2017-11-17 00:10:06,"b""TransCanada's Keystone pipeline leaked roughly 5,000 barrels of oil in South Dakota https://t.co/IDu8N8MYeo"""
931310960647684096,2017-11-17 00:00:10,b'Dallas Cowboys owner Jerry Jones is not backing down https://t.co/4ej92tXGPO'
931308412129894400,2017-11-16 23:50:02,"b'College football should respect the Wisconsin Badgers, says @jasongay https://t.co/5L4zXnxdNp'"
931307010288734211,2017-11-16 23:44:28,b'Special counsel Robert Mueller\xe2\x80\x99s team in mid-October issued a subpoena to Trump\xe2\x80\x99s campaign requesting Russia-relate\xe2\x80\xa6 https://t.co/r6kb4GDBcQ'
931305948647391233,2017-11-16 23:40:15,b'Opinion: Killing the ObamaCare individual mandate will make it easier to restore insurer subsidies https://t.co/70gaSGeTKU'
931303398770692096,2017-11-16 23:30:07,b'Experts agree on the best treatment for opioid addiction. The problem is many rehab facilities refuse to offer it. https://t.co/W7teoMuFmr'
931300875737419777,2017-11-16 23:20:06,b'Connecticut Lt. Gov. Nancy Wyman said she won\xe2\x80\x99t run for governor in 2018 https://t.co/jVvfBJdqxh'
931298375068258304,2017-11-16 23:10:09,"b""Jerry Jones wants sit-down with other NFL owners, cites 'threats of retaliation' against him https://t.co/Ve7uzWyfli"""
931295589765173249,2017-11-16 22:59:05,"b""A traveler's guide to chasing the northern lights in the Arctic, by snowshoe, reindeer sleigh or dogsled\nhttps://t.co/5FwbZah9qE"""
931295350048030720,2017-11-16 22:58:08,"b'Verizon is the latest suitor to pursue some assets of 21st Century Fox, which have drawn interest from Disney and C\xe2\x80\xa6 https://t.co/BXzUifbZLP'"
931293319413620736,2017-11-16 22:50:04,"b'It\xe2\x80\x99s time to respect the undefeated Badgers from Madison, says @JasonGay \nhttps://t.co/gC5op5Fq7M'"
931292059612393472,2017-11-16 22:45:04,"b'Opinion: Zimbabwe\xe2\x80\x99s generals swear what they started doing in the early hours of Wednesday morning isn\xe2\x80\x99t a coup, bu\xe2\x80\xa6 https://t.co/U7oWCbMbJ1'"
931290844031696896,2017-11-16 22:40:14,b'Wal-Mart got a boost from a big jump in e-commerce and strong store traffic https://t.co/XoKe0a9otY'
931289927647510529,2017-11-16 22:36:35,b'Comcast has approached Fox over buying assets similar to those Disney was interested in https://t.co/eXSDEBUjNS'
931288310340837376,2017-11-16 22:30:10,"b""Paleo diet too meaty for you? How about 'Never Ending Pasta'? https://t.co/w7drjeAxJl"""
931285836288716803,2017-11-16 22:20:20,b'Is abortion murder? Google now offers a definitive answer to that and other contentious questions. https://t.co/xBCu5Y2U6g'
931283276312006657,2017-11-16 22:10:10,"b""Zimbabwe's longtime ruler has been under house arrest since the military took over institutions in the capital. How\xe2\x80\xa6 https://t.co/DcatTJKd3f"""
931282644473483264,2017-11-16 22:07:39,b'Trump expected to name budget director Mulvaney as interim head of consumer-finance watchdog; he will maintain OMB\xe2\x80\xa6 https://t.co/PG8v3799n2'
931280508310446080,2017-11-16 21:59:10,b'Jobs that have become the most digital in the past decade have seen the fastest wage growth\nhttps://t.co/NbFMYuBWRu'
931279495281152000,2017-11-16 21:55:08,"b""Breaking: Comcast has approached 21st Century Fox about an acquisition; unclear whether it's all or a partial purch\xe2\x80\xa6 https://t.co/VriEJtta0B"""
931278243914592256,2017-11-16 21:50:10,"b'U.S. management of Indian hospitals is crumbling, as criticism over care mounts https://t.co/cETm450r6k'"
931276204241547270,2017-11-16 21:42:04,"b'Opinion: My administration made New Jersey better\xe2\x80\x94and it wasn\xe2\x80\x99t easy, writes @ChrisChristie https://t.co/cHjLz2xZk3'"
931275709791731715,2017-11-16 21:40:06,"b""'Justice League' review: The latest from the DC cinematic universe trafficks in convincing depression and ersatz el\xe2\x80\xa6 https://t.co/ZkbWEQEhSM"""
931273206668853249,2017-11-16 21:30:09,b'Some veteran brokers say new growth hurdles at Merrill Lynch are high and make it likely pay will fall for many nex\xe2\x80\xa6 https://t.co/c3GcA4OGYS'
931270708939894785,2017-11-16 21:20:13,"b'The conflict: One roommate owns a bold, blocky seat, the other a delicate Art Deco floor lamp. Three designers offe\xe2\x80\xa6 https://t.co/hNnYzVFok2'"
931268177094377472,2017-11-16 21:10:10,b'A wine connoisseur heads home to fly-over country https://t.co/t0symvzYx2'
931265402218393600,2017-11-16 20:59:08,"b'Mashable sold for around $50 million, a fraction of the company\xe2\x80\x99s valuation less than two years ago\nhttps://t.co/QpRkqYIMqp'"
931263135054516224,2017-11-16 20:50:08,"b'Enrollment has plummeted at Valparaiso University Law School: This year\xe2\x80\x99s incoming class had 29 full-time students,\xe2\x80\xa6 https://t.co/dymp1Uo8j2'"
931261888469413888,2017-11-16 20:45:10,"b'Opinion: Political animosities are pushing the U.S. toward a significant political crisis, writes @DanHenninger https://t.co/U4KUBAB4mg'"
931261307986300935,2017-11-16 20:42:52,b'RT @WSJCS: Paid Program for Airbus: Dubai is constantly reinventing itself with incredible feats of engineering. https://t.co/xP5XDoc4Ck vi\xe2\x80\xa6'
931260617146753028,2017-11-16 20:40:07,b'An ICE official said a six-week operation targeted the MS-13 gang\xe2\x80\x99s most dangerous members\nhttps://t.co/WiZCt38EfN'
931258092465082373,2017-11-16 20:30:05,"b""The FCC chairman said 'few of the FCC\xe2\x80\x99s rules are staler' than the broadcast media ownership rules that were change\xe2\x80\xa6 https://t.co/hkvvKERD4F"""
931257040047046657,2017-11-16 20:25:54,b'The U.S. is researching the development of a banned cruise missile to counter what it sees as Russian arms-treaty v\xe2\x80\xa6 https://t.co/1KOF8tBsni'
931255606207483905,2017-11-16 20:20:13,"b'Leeann Tweeden, a model and broadcast host, said the incident with Al Franken occurred in December 2006 during a US\xe2\x80\xa6 https://t.co/6mvfBDWjdw'"
931253094259847168,2017-11-16 20:10:14,b'The U.S. House backed a plan that would lower the corporate tax rate to its lowest point since 1939 and cut individ\xe2\x80\xa6 https://t.co/A3LL5W0UpI'
931252175434670081,2017-11-16 20:06:35,b'Prospects for a 2018 BuzzFeed initial public offering now appear remote\nhttps://t.co/zkoGOZ7dUI'
931250287045726214,2017-11-16 19:59:04,"b'\xe2\x80\x98Roman J. Israel, Esq.\xe2\x80\x99 film review: Denzel Washington stars as a lawyer from another era in Dan Gilroy\xe2\x80\x99s florid cr\xe2\x80\xa6 https://t.co/kyHr15EjzT'"
931248034813501441,2017-11-16 19:50:07,"b'Linguine, breadsticks, meatballs? Welcome to the Olive Garden diet.  https://t.co/U8Ft0Y4PYI'"
931245546492309505,2017-11-16 19:40:14,b'How the tax legislation in Congress would affect people saving for retirement\nhttps://t.co/PAf85nSq7L'
931243016987332609,2017-11-16 19:30:11,b'Mugabe\xe2\x80\x99s ousted vice president stands ready for a return to power https://t.co/PVQ0c5hD3p'
931240479634657282,2017-11-16 19:20:06,"b""Want to see Google's power in action? It now offers definitive answers to complex questions. https://t.co/vTb0llfgMS"""
931238799153213440,2017-11-16 19:13:25,b'Real women wear tuxedos https://t.co/J50eypWlEL'
931235453424033792,2017-11-16 19:00:08,b'This street-legal monster does 0-60 in 2.7 seconds https://t.co/N1Exw7dg0f'
931233426958626816,2017-11-16 18:52:05,b'House reaches the votes it needs to pass tax-overhaul bill; Senate legislation faces less certain prospects https://t.co/B7mj307SkV'
931231676054810626,2017-11-16 18:45:07,b'DOJ antitrust chief casts doubts on corporate promises to behave differently after a merger https://t.co/QiDVaj7Gj7'
931227884609523712,2017-11-16 18:30:03,"b'If Wal-Mart keeps boosting online sales and maintains solid profits, investors might be less willing to give Amazon\xe2\x80\xa6 https://t.co/rml2xl6L8y'"
931226673693020160,2017-11-16 18:25:15,"b""Joseph Otting gets Senate's approval to be comptroller of the currency https://t.co/LEWMHpeOM3"""
931224141126164480,2017-11-16 18:15:11,"b""Barnes &amp; Noble investor proposes company go private; plan by Sandell Asset Management isn't supported by chairman R\xe2\x80\xa6 https://t.co/KvbxlHZQ8Q"""
931223104986238976,2017-11-16 18:11:04,"b""Sen. Robert Menendez's trial on bribery charges ends in mistrial https://t.co/hK5Enygg64"""
931222864254197761,2017-11-16 18:10:06,"b""'That\xe2\x80\x99s the dumbest bunch of shit I\xe2\x80\x99ve ever seen': Gordon Bethune, former Continental boss, responds to a Google an\xe2\x80\xa6 https://t.co/pWGJM6ZIia"""
931222168041607168,2017-11-16 18:07:20,"b'Joel Embiid is as talented as anyone in the NBA. Five years ago, he was still playing JV basketball. https://t.co/sMJHdNq4Mg'"
931220386515226624,2017-11-16 18:00:16,"b'Companies are starting to forgo buybacks, which have become more expensive https://t.co/YDhQmRuMXc'"
931216579962048518,2017-11-16 17:45:08,"b'Best Buy sales rose, but less than analysts expected. To blame: storms and a later iPhone launch https://t.co/LukS43Kdlc'"
931216314198315008,2017-11-16 17:44:05,"b""Sen. Al Franken faces sexual-misconduct allegations from 2006 incident; Democrat offers 'sincerest apologies' https://t.co/5C78ADreCf"""
931213792532402176,2017-11-16 17:34:03,b'The jury in the Menendez trial says it is still unable to agree https://t.co/t5Ps6Bx6qa'
931212841528516614,2017-11-16 17:30:17,"b'Most of the return on art is psychic, not financial, measured in units of pride or pleasure https://t.co/AeAO1DqBUA'"
931209031804473349,2017-11-16 17:15:08,"b'Where do 5,000 rabbis head for dinner? Bayonne, N.J., of course https://t.co/k4hZnq9gQs'"
931205425978068992,2017-11-16 17:00:49,"b'As ISIS loses ground in Syria, Israel sees a rising threat from Iran and Hezbollah, writes @yarotrof https://t.co/1Uz1OhA3xD'"
931198701275529216,2017-11-16 16:34:05,"b'Today on Snapchat: The story behind Stitch Fix, plus where to look for a holiday job. https://t.co/wEeXqVOLcG https://t.co/yxUw5bhqoN'"
931197953041227777,2017-11-16 16:31:07,b'N.C. pastor has a weight-loss tip. Eat only at Olive Garden https://t.co/iTEAuCefkR'
931197704071471109,2017-11-16 16:30:08,"b""Think the Heartland's all about beer? Think again. @LettieTeague1 launches a series on wine in the Midwest with a v\xe2\x80\xa6 https://t.co/kClFIKx05m"""
931193673961955331,2017-11-16 16:14:07,b'From colonial staple to political emblem to holiday standby: A short but tasty history of pumpkin pie https://t.co/g1SloFNT5B'
931193158733574144,2017-11-16 16:12:04,"b""The world's largest sovereign fund is considering pulling out of oil stocks https://t.co/iqgPeZ5dy9"""
931191649648160768,2017-11-16 16:06:04,b'Google doesn\xe2\x80\x99t just want to be a search engine. It thinks it can be an arbiter of truth https://t.co/eQxwkktBW2'
931189895514742789,2017-11-16 15:59:06,"b'Charles Koch Foundation gave to schools ranging from tiny Catholic colleges to Harvard, Brown and NYU in 2016 https://t.co/6vG2nGQ1Nd'"
931186358156132353,2017-11-16 15:45:03,b'Sunni Muslims in Lebanon who once looked to Saudi Arabia as a close ally are venting anger at the kingdom over the\xe2\x80\xa6 https://t.co/C9f8Gi98C3'
931182613150257152,2017-11-16 15:30:10,"b'The plague, also known as Black Death, is endemic to Madagascar\xe2\x80\x94a recent outbreak has struck densely populated citi\xe2\x80\xa6 https://t.co/LQsgZ25bDA'"
931182324934479873,2017-11-16 15:29:01,b'Amateur hour: Jack Ma\xe2\x80\x99s entertainment ventures haven\xe2\x80\x99t made for box office gold https://t.co/BUKzzFFrLg'
931179508962660353,2017-11-16 15:17:50,"b'The Fed\xe2\x80\x99s communication strategy is encouraging complacency. It\xe2\x80\x99s time to give the market a real surprise, writes J\xe2\x80\xa6 https://t.co/4Gs08GnXm2'"
931177569633923072,2017-11-16 15:10:07,b'Online publishers adopt transparency standards to help readers spot trustworthy news; Google and Facebook will use\xe2\x80\xa6 https://t.co/LPBhNoHtqz'
931176352606244864,2017-11-16 15:05:17,b'The 10-Point: @Gerardtbaker on Nelson Peltz\xe2\x80\x99s push into P&amp;G and more https://t.co/wzx0IRigWg \n\nSign up here:\xe2\x80\xa6 https://t.co/yReR5WevIt'
931174336538476544,2017-11-16 14:57:16,b'Oil prices have risen more than 20% since the start of September https://t.co/riES1BSGJf'
931169818375540736,2017-11-16 14:39:19,"b""Pyongyang\xe2\x80\x99s nuclear ambitions stand in the way of a reconciliation, South Korea's unification minister says https://t.co/pfShLybs5x"""
931167231161131008,2017-11-16 14:29:02,b'The best opioid addiction treatment recommended by experts is one many rehab facilities refuse to offer https://t.co/MZ8Ez2feeI'
931165274652495873,2017-11-16 14:21:16,"b""With Zimbabwe's future in limbo, Robert Mugabe\xe2\x80\x99s motorcade moves from his private home to the military-controlled S\xe2\x80\xa6 https://t.co/2b4gX40c9M"""
931164982921846784,2017-11-16 14:20:06,"b'U.S. jobless claims rose to 249,000 last week https://t.co/CYKXKLIEmG'"
931162477265653760,2017-11-16 14:10:09,"b'German engineering giant Siemens expected to unveil a broad restructuring that could involve as many as 4,000 job c\xe2\x80\xa6 https://t.co/wuAlNGqc8U'"
931160048725905408,2017-11-16 14:00:30,b'The best opioid addiction treatment recommended by experts is one many rehab facilities refuse to offer https://t.co/lU4ro3MOv6'
931159984666181633,2017-11-16 14:00:15,"b'As \xe2\x80\x98unicorn\xe2\x80\x99 startups such as Snap and WeWork come under greater scrutiny, some chief executives opt for more modes\xe2\x80\xa6 https://t.co/5YdCOelSOw'"
931156204784676865,2017-11-16 13:45:13,"b'Madagascar is scrambling to contain its worst outbreak of plague in at least 50 years, with more than 170 dead https://t.co/0ih0TSBtfH'"
931152433451032577,2017-11-16 13:30:14,b'Pressure is on Fiat Chrysler as it gets ready to release the first major update to the Jeep Wrangler since 2007  https://t.co/w10jrVzIrA'
931148684993187840,2017-11-16 13:15:21,"b'Wal-Mart posted strong sales gains in the latest period, boosted by a big jump in e-commerce and post-hurricane dem\xe2\x80\xa6 https://t.co/irteZRjDYA'"
