id,created_at,text934286789057105920,2017-11-25 05:05:03,b'A doomed Chechen hit man tells all during a jailhouse interview. Or does he?\nhttps://t.co/Hq6DsLsiL0'
934277978695094272,2017-11-25 04:30:02,b'Holidays are now the only time of year when we really focus on what and how we eat - and that is a source of securi\xe2\x80\xa6 https://t.co/33VozKB8vw'
934270440943620097,2017-11-25 04:00:05,"b""A Barbie line popularizes the word 'sheroes'\nhttps://t.co/WXVBA74DxC"""
934262934645149696,2017-11-25 03:30:16,"b'In the mid-1960s, when a computer still filled a large room, a Wall Street analyst saw how the technology could tra\xe2\x80\xa6 https://t.co/g6lV95EM8I'"
934255379319607296,2017-11-25 03:00:14,"b'In high-profile trials, finding jurors who don\xe2\x80\x99t come armed with opinions can be difficult https://t.co/1Na2fKFGRs'"
934247804825952256,2017-11-25 02:30:08,b'Hacker expected to plead guilty in 2014 Yahoo breach https://t.co/YUPca4EAGS'
934240264037814278,2017-11-25 02:00:10,"b'Bobby Baker once received $2,500 for making a single phone call to regulators for a bank in California https://t.co/tUD4z4kNsn'"
934237208885723136,2017-11-25 01:48:02,b'CFPB leadership thrown into uncertainty as the president and the agency\xe2\x80\x99s departing Obama-era leader both name temp\xe2\x80\xa6 https://t.co/EyMyNM7vmZ'
934232693897822208,2017-11-25 01:30:06,"b'Analysts predict robust holiday sales, underpinned by rising wages, low unemployment and strong consumer confidence https://t.co/kybJV9HWDb'"
934231424164655104,2017-11-25 01:25:03,b'Police say the immediacy of social media has played a major role in escalating real-world disputes https://t.co/RZEj76bdM9'
934225173523369984,2017-11-25 01:00:13,b'A pioneer in electronic stock trading founded Instinet but left before it grew into a major force https://t.co/1kWvP8zAo2'
934221367842553856,2017-11-25 00:45:05,b'Distribution centers are adding more workers ahead of an expected surge in web sales this holiday season\nhttps://t.co/6GMrnGuHLZ'
934217589617823744,2017-11-25 00:30:04,b'Unilever has kicked off the search for a new CEO \xe2\x80\x94 initiating what is expected to be a monthslong process to replac\xe2\x80\xa6 https://t.co/ehUZu1ENiB'
934212543962337282,2017-11-25 00:10:01,b'\xe2\x80\x98I thought only I could deliver those lines.\xe2\x80\x99 An interview with actress Kristin Scott Thomas https://t.co/tVFecCvQi9'
934210043691618304,2017-11-25 00:00:05,b'CFTC chief is an avid guitar and banjo player and spent his 50th birthday playing a club in New Jersey https://t.co/lxOhE088F9'
934209002019409920,2017-11-24 23:55:57,"b'President Trump plans to stop sending weapons directly to Kurdish militants battling Islamic State in Syria, offici\xe2\x80\xa6 https://t.co/J7FiwMPziB'"
934207536261189632,2017-11-24 23:50:08,"b'Nike, Macy\xe2\x80\x99s suffer technical snafus on Black Friday https://t.co/Qf75iIhxRP'"
934207260070260736,2017-11-24 23:49:02,"b""Obituary: Walter Smith's newspapers in New York and Philadelphia focused on black communities"""
934207033133420549,2017-11-24 23:48:08,"b'A look at Black Friday across America in photos, then and now https://t.co/PTu9yIAKuz'"
934201222604705793,2017-11-24 23:25:02,"b""CFPB's Cordray steps down a few days early and promotes chief of staff to deputy director, effectively naming his o\xe2\x80\xa6 https://t.co/YI04X4GF3f"""
934198708597612549,2017-11-24 23:15:03,b'Irish exporters look to U.S. and Asia as they diversify away from U.K. market https://t.co/O8pxRjsuby'
934194946378289153,2017-11-24 23:00:06,b'The pope\xe2\x80\x99s trip to Myanmar and Bangladesh reflects his focus on Catholic \xe2\x80\x98peripheries\xe2\x80\x99 \xe2\x80\x94 and their controversies\nhttps://t.co/6TrVoZqohZ'
934192440587808769,2017-11-24 22:50:08,b'Special counsel focuses on Mike Flynn\xe2\x80\x99s links to Turkish film project as legal team\xe2\x80\x99s move signals possible coopera\xe2\x80\xa6 https://t.co/czqZbkJCKX'
934192430072631296,2017-11-24 22:50:06,"b'Thousands of students of a for-profit law-school empire have dropped out, transferred or failed bar exams https://t.co/R6oDAY7SmV'"
934191925174947840,2017-11-24 22:48:06,b'Australians have their hands full saving 45 million migrating crabs  https://t.co/SWtKPEpNGp'
934191168354766848,2017-11-24 22:45:05,"b'Trump, Senate Republicans to huddle ahead of key tax vote\nhttps://t.co/9p0uCqMZv6'"
934186133533192192,2017-11-24 22:25:05,"b'A drunken Santa Claus? A burlesque Nutcracker? Behold the new holiday entertainment, NYC-style... https://t.co/Bij8yTj3sE'"
934184896985264134,2017-11-24 22:20:10,"b""Actress Kristin Scott Thomas talks about her career and her latest role, playing Churchill's wife https://t.co/eGtTEniUtd"""
934179989276250115,2017-11-24 22:00:40,"b'Opinion: President Clinton should have pursued health-care legislation with bipartisan support, writes @JoeLieberman https://t.co/U2BQ2AsSvV'"
934179845935894528,2017-11-24 22:00:06,b'Tech firms have been a major factor behind indexes\xe2\x80\x99 fevered gains this year\xe2\x80\x94and investors expect that to persist https://t.co/rsqvNyhCri'
934172316145201152,2017-11-24 21:30:10,"b""Saudi Arabia holds sway in the future of Lebanese Prime Minister Saad Hariri's political life and family business https://t.co/VOsAvchxqP"""
934166492786184192,2017-11-24 21:07:02,"b""Pope calls anti-immigrant rhetoric 'demeaning [to] human dignity' https://t.co/UdIc5Em8Wq"""
934166255506001920,2017-11-24 21:06:05,"b""'What if you said, a slap shot is a two-point shot?' https://t.co/xNCkf2F8Cz"""
934164756629544965,2017-11-24 21:00:08,"b'Investors pick active funds based on performance, but long-term success is often no more dependable than a coin flip https://t.co/HGqBLKnF2z'"
934160998109458433,2017-11-24 20:45:12,b'Business dealings of Lyndon B. Johnson prot\xc3\xa9g\xc3\xa9 led to a scandal and 16 months in prison https://t.co/cPYQ0iCXfA'
934159202284695554,2017-11-24 20:38:04,b'RT @WSJCS: Paid Program for VistaJet: High-net-worth consumers turn to the on-demand economy for luxury retail and services. https://t.co/g\xe2\x80\xa6'
934157685162987521,2017-11-24 20:32:02,b'The EU is focusing on encouraging trade and giving its eastern partners extra leverage with the Kremlin https://t.co/Whe0f72xCA'
934157219645526016,2017-11-24 20:30:11,b'Students of a for-profit law-school empire are struggling to pay down more than $1 billion in loans https://t.co/AaGKcaD6wU'
934155171130675201,2017-11-24 20:22:03,b'What do Australian motorists do when there\xe2\x80\x99s a crab in the road? Slow down and aim for it https://t.co/aQcOEWPvF0'
934154674264997890,2017-11-24 20:20:04,b'Never before have big employers tried so hard to hand over chunks of their business to contractors https://t.co/DjUiFMhEMn'
934153439751430145,2017-11-24 20:15:10,b'Uber and McDonald\xe2\x80\x99s are among a growing group of employers giving workers near-instant access to their wages https://t.co/QETw3QhaAo'
934149740152918018,2017-11-24 20:00:28,"b'Face it, college football fans: The Iron Bowl has become the only rivalry that really matters https://t.co/u38xFYFd7d'"
934149646355718144,2017-11-24 20:00:06,"b'S&amp;P 500 has clinched 54 record closes this year, the most in more than 20 years https://t.co/IZKmjieb4C'"
934144855885926401,2017-11-24 19:41:03,b'Maker of \xe2\x80\x98Pok\xc3\xa9mon Go\xe2\x80\x99 lands funding from Spark Capital https://t.co/RLQsP9baV1'
934139364778668033,2017-11-24 19:19:14,"b'Will it be a Manhattan apartment, a Tucson estate or a Houston house?https://t.co/WPFYCSH1mg'"
934135046247763968,2017-11-24 19:02:05,"b""Whitefish Energy says it's back at work after Puerto Rico\xe2\x80\x99s power utility released some of the money it was owed https://t.co/A8oe5mXXb3"""
934134534530101248,2017-11-24 19:00:03,"b""'You see people get into it with someone [on Facebook] and the next day they are beaten up or shot.' One 10th-grade\xe2\x80\xa6 https://t.co/drqpBpFa7Q"""
934134534307766272,2017-11-24 19:00:03,"b'CFTC chief compares himself to Janus, the Roman god who faces both the past and the future https://t.co/Ept0YLtv4f'"
934130771161436160,2017-11-24 18:45:05,b'Stocks\xe2\x80\x99 upward climb has defied many analysts early-year predictions for a 2017 stall  https://t.co/UDbhL1CMFc'
934128247046012928,2017-11-24 18:35:04,"b'U.S. stocks notched another milestone Friday, with the S&amp;P 500 rising above 2600 https://t.co/zjDhnPXwGR'"
934124482402439168,2017-11-24 18:20:06,"b""It's a time of reckoning in North Dakota after the oil boom wanes https://t.co/QGx9wqo1pU"""
934123212388134913,2017-11-24 18:15:03,"b'Retailers dangle the usual Black Friday promotions, including 30% off at Coach and 50% off at Gap https://t.co/SygCIe6owe'"
934119469449871360,2017-11-24 18:00:11,"b""Black Friday isn't what it used to be https://t.co/O2O98c91nk"""
934115919961427968,2017-11-24 17:46:05,b'London police say no evidence of shots fired or any casualties after reports of incident in Oxford Circus https://t.co/ivw3QQa2cE'
934115690096877568,2017-11-24 17:45:10,"b""'If you are on Oxford Street go into a building,' London police said https://t.co/S0fVEhO2MA"""
934115170716176384,2017-11-24 17:43:06,"b""Inside the unraveling of a for-profit law-school empire: 'The whole system broke down' https://t.co/NQC5nsEC5F"""
934113665074302981,2017-11-24 17:37:07,"b'For Mike Flynn, terminating a joint defense agreement with President Trump\xe2\x80\x99s legal team could mean several differen\xe2\x80\xa6 https://t.co/bLyhQFiw3n'"
934111957908705280,2017-11-24 17:30:20,"b'Opinion: Charles Dickens makes me want to throw up, writes David Mamet https://t.co/9p7Uu6KDmZ'"
934111925755138049,2017-11-24 17:30:12,"b""The latest developments in Lebanon show Saudi Arabia's sway over the country and its leader https://t.co/gpB8ZcLfSd"""
934108642936270848,2017-11-24 17:17:10,b'Shares of brick-and-mortar retailers rally https://t.co/wspHsCGZnP'
934108122758643712,2017-11-24 17:15:06,b'CFOs say the ubiquitous spreadsheet software hasn\xe2\x80\x99t kept up with the demands of modern corporate finance https://t.co/ztfafZxDeG'
934104348640018432,2017-11-24 17:00:06,"b""Can't wait until payday? New apps are giving workers instant access to their wages https://t.co/z6PZgSpdzr"""
934102322371842049,2017-11-24 16:52:03,"b'On Christmas Island, red crabs get roadside assistance https://t.co/ZgRmp5niFo'"
934101821110571010,2017-11-24 16:50:03,"b'Opinion: A $10,000 grant for theater \xe2\x80\x98celebrating the saguaro cactus\xe2\x80\x99? The National Endowment said yes, writes\xe2\x80\xa6 https://t.co/wLcVF0TYob'"
934099309565546496,2017-11-24 16:40:04,b'A pioneer in electronic stock trading found it wasn\xe2\x80\x99t so easy to bypass the middleman https://t.co/nP9uoiewXI'
934096838638161920,2017-11-24 16:30:15,"b""WSJ's @bgzimmer discusses the march of 'shero,' including 21st-century Barbies https://t.co/VvuUBJJrpw"""
934096786066731008,2017-11-24 16:30:03,"b""Pixar's 'Coco' is 'exuberant and heartfelt' https://t.co/q9qJdP1MJG"""
934094292259344385,2017-11-24 16:20:08,"b""Experts are skeptical Zimbabwe's new president, who is under U.S. sanctions, will hail in the new era hoped for https://t.co/3ZoHPMXhEX"""
934092330017181698,2017-11-24 16:12:20,b'Death toll rises to 235 in Sinai mosque attack https://t.co/kBLb7Xr4jq'
934091759008862208,2017-11-24 16:10:04,"b'After four double martinis, Bobby Baker resigned from his Senate job. He hoped that would end his legal troubles.Th\xe2\x80\xa6 https://t.co/SE1EUS0dyf'"
934089310189604864,2017-11-24 16:00:20,b'Christmas shopping for the kids on a budget? Check out our price-gauging tool for must-have gifts https://t.co/lKnelARwB9'
934085485030510592,2017-11-24 15:45:08,"b'Vietnam seeks investors for its biggest brewer, Sabeco, which sells brands like 333 and Saigon Beer https://t.co/DWdggw510k'"
934083464877441024,2017-11-24 15:37:07,"b""Dollar weakens to its lowest level since mid-October, boosting copper prices. But the metal's gains may be at risk https://t.co/WoV92VGVoX"""
934081733594632194,2017-11-24 15:30:14,b'Why this veteran investor says stock picking and coin flipping are similar \xe2\x80\x94 Heard on the Street https://t.co/dytW0yZXD7'
934081696252776448,2017-11-24 15:30:05,b'Ireland is lending and spending to help its businesses survive Brexit https://t.co/3Y2Yn6GUDG'
934077953511747584,2017-11-24 15:15:13,b'Mitsubishi car and plane parts with tampered quality data may have been shipped to U.S. https://t.co/POSqVUBUCi'
934076738027614210,2017-11-24 15:10:23,b'Assailants in Egypt mosque attack detonated bomb before firing at people trying to flee https://t.co/6uD5QBnuFO'
934074178944237568,2017-11-24 15:00:13,b'Why the new Uber CEO delayed publicizing the 2016 hack https://t.co/oEvMvq78Ks'
934072381706067969,2017-11-24 14:53:04,"b'Mexican economy shrinks between July and September, as two major earthquakes impair oil production and kill hundreds https://t.co/PuzZXyK74Q'"
934070365667676160,2017-11-24 14:45:04,"b'Big brands including Mars, Adidas and Diageo have halted advertising on YouTube https://t.co/uMukdphfHK'"
934066614756102144,2017-11-24 14:30:09,b'How Facebook and others have emerged as new frontiers in the fight against violent crime https://t.co/HnUTXMGUP4'
934063011324710913,2017-11-24 14:15:50,b'Assailants detonated a bomb at the Al Rawda mosque before firing at people trying to flee https://t.co/tvtG4KJxrt'
934061802870247424,2017-11-24 14:11:02,"b'Opinion: The Trump Treasury should know that low rates don\xe2\x80\x99t last forever, writes @FreemanWSJ https://t.co/VFk5itYAyT'"
934059082234941440,2017-11-24 14:00:13,b'Why Black Friday is no longer the busiest shopping day of the year https://t.co/bw0kCM5mUh'
934056545159086081,2017-11-24 13:50:08,b'Death toll in Egypt mosque attack climbs to 155 https://t.co/z11fpMjDIh'
934054041834938368,2017-11-24 13:40:12,"b""More employers like McDonald's and Uber are giving workers near-instant access to their wages through payday apps https://t.co/VdBBFpS4pb"""
934051549487226880,2017-11-24 13:30:17,"b""The time isn\xe2\x80\x99t right for a bet on lithium, says WSJ's Nathaniel Taplin https://t.co/0B9ODN5gsx"""
934049228430757893,2017-11-24 13:21:04,b'Zimbabwe\xe2\x80\x99s new leader urges foreign investors to return and asks governments to drop sanctions https://t.co/yf8FPf6R10'
934046469375643648,2017-11-24 13:10:06,b'How insurers and pensions could give investors a fright in the next market downturn \xe2\x80\x94 Heard on the Street https://t.co/YKpxjFvNc1'
934043991724707840,2017-11-24 13:00:15,b'Doomed hired gun unburdens himself in a jailhouse interview that sheds light on the Russia-Ukraine shadow battle https://t.co/y36UvcUBy6'
934043480585883649,2017-11-24 12:58:14,b'At least 85 dead and scores wounded after gunmen attack mosque in Sinai Peninsula https://t.co/aZGfGBJKD0'
934041422398976001,2017-11-24 12:50:03,"b'More than 620,000 people have fled Myanmar for Bangladesh since the crackdown on Rohingya Muslims began https://t.co/sHt6gnGjuL'"
934039658811543552,2017-11-24 12:43:02,b'Global stocks head for weekly gains; eurozone economy picks up https://t.co/JmjWk7eqBs https://t.co/IKMJwPQyjk'
934038942323576834,2017-11-24 12:40:12,b'CFTC chief leans on his ability to reach out to Democrats as he reviews postcrisis regulations https://t.co/oXYeyl3hS4'
934036460348608512,2017-11-24 12:30:20,b'Startups are betting there\xe2\x80\x99s a chance to create the Tencent or Alibaba of the enterprise market\nhttps://t.co/xrNIy6coAc'
934035029344301061,2017-11-24 12:24:39,b'At least 75 people hurt in attack on mosque in Sinai Peninsula during Friday prayers \nhttps://t.co/Xitm0tmKLG'
934032661135462401,2017-11-24 12:15:14,b'Five charts that show the changing face of corporate bond markets https://t.co/ZRxJks37wo'
934030591175155712,2017-11-24 12:07:01,"b""Oil prices edge up in subdued holiday trade, as investors await next week's OPEC meeting https://t.co/V0cAPNvb8J"""
934028892930789376,2017-11-24 12:00:16,"b""'The deal size... wasn\xe2\x80\x99t coming through': KKR disbands Africa private-equity team https://t.co/WLVjT3ExYG"""
934028513191047169,2017-11-24 11:58:45,"b'CBS and Dish reach carriage agreement, restoring stations to more than 2 million subscribers https://t.co/amdYZDkrnl'"
934025094011277312,2017-11-24 11:45:10,"b""Germany\xe2\x80\x99s Social Democrats agree to talks but say they aren't ready to rebuild grand coalition with Merkel https://t.co/nVIFlxMXYI"""
934021320358223873,2017-11-24 11:30:10,b'A duck that travels and a cheese that doesn\xe2\x80\x99t: Irish exporters pivot for Brexit https://t.co/K1QHDF6fGF'
934018778895192066,2017-11-24 11:20:04,"b'Retailers are grappling with a host of problems, including shopping shifting online. But a bright spot has emerged https://t.co/USuXwEdo6U'"
934016252120633344,2017-11-24 11:10:02,"b""Vigilant Ace 18 drill is 'designed to ensure peace and security on the Korean Peninsula' https://t.co/etteMEfQaf"""
934013777212829697,2017-11-24 11:00:12,"b'Picking a fund manager who beats the index is tough, but picking one who beats it through  ability is harder still https://t.co/8XIFEWEdRo'"
934011705172033536,2017-11-24 10:51:58,"b""Lebanese prime minister's fraying relations with Saudi Arabia color the future of his country and his business https://t.co/DeNsB0IVSQ"""
934008718672498689,2017-11-24 10:40:06,b'Analysts are putting lofty targets on where the S&amp;P 500 will go next year https://t.co/zVxcLrbcHe'
934006220981075969,2017-11-24 10:30:10,b'Take an early look at the front page of The Wall Street Journal   \nhttps://t.co/5xQPDOUKJQ https://t.co/WY69RkXMou'
934004481108389888,2017-11-24 10:23:15,b'Global stocks set for weekly gains https://t.co/eMzabqxWIG https://t.co/g85BmjZR3B'
934002671140442112,2017-11-24 10:16:04,"b'Wall Street know a lot less about how the economy works than it thinks, writes @Jmackin2 https://t.co/ilZhsUQNRx'"
933998687013007362,2017-11-24 10:00:14,"b'Slowing pace of buybacks hasn\xe2\x80\x99t hindered stock prices much, with major indexes climbing to  fresh records  https://t.co/C7QIADvSf7'"
933994893713838080,2017-11-24 09:45:10,"b""Uber's new CEO learned of hack in September, says he wanted to complete probe before making matter public https://t.co/5x3klchz0R"""
933991093292683264,2017-11-24 09:30:04,b'Lithium and battery plays are on a joy ride into the stratosphere. Rio Tinto shouldn\xe2\x80\x99t follow \xe2\x80\x94 Heard on the Street https://t.co/5nvGWoVpN0'
933988680066392065,2017-11-24 09:20:28,b'European stocks wobble around the flatline; Chinese markets stabilize after biggest one-day drop in nearly a year https://t.co/SnOac6gg9N'
933983594707652608,2017-11-24 09:00:16,"b'Vietnam seeks investors for its largest brewer, Sabeco, which has a market cap of around $8.7 billion https://t.co/2wzFJUTFVZ'"
933979816893845504,2017-11-24 08:45:15,"b""Corporate bonds have become harder to trade\xe2\x80\x94and that's a concern for the European Commission https://t.co/y6ce3TCnng"""
933977249581359105,2017-11-24 08:35:03,b'Chinese consumer tech is a success but its enterprise-application market is a different story\nhttps://t.co/7AlGlR7TNP'
933976475891568641,2017-11-24 08:31:58,b'Oscar Pistorius\xe2\x80\x99s prison sentence is increased to 13 years and five months for murdering his girlfriend in 2013 https://t.co/dTBGYJRDqH'
933972232744906753,2017-11-24 08:15:07,b'A new Thanksgiving tradition: Chinese stock market drops https://t.co/rcacDh5NHa https://t.co/7RBEIbQIlg'
933968503463440384,2017-11-24 08:00:18,"b""The one word the pope\xe2\x80\x99s own bishops are afraid he will utter in Myanmar: 'Rohingya' https://t.co/tRRxvop71s"""
933964661728432128,2017-11-24 07:45:02,b'Clariant makes the offer to activist investors but rejects their proposal to hire an investment bank to explore str\xe2\x80\xa6 https://t.co/Jm1ut4jF58'
933960954018136065,2017-11-24 07:30:18,"b'Forecasting is difficult, but this year showed exactly how pointless it can be: Markets performed opposite of virtu\xe2\x80\xa6 https://t.co/qQT7mrotoP'"
933957115504455680,2017-11-24 07:15:03,b'Corporate debt mystery: Why are bonds getting harder to trade if firms are issuing more? https://t.co/mWR043e6Vt'
933953363724656640,2017-11-24 07:00:08,b'Hundreds of millions of Indians have no credit history. Banks are using new technology to scan their phones and unl\xe2\x80\xa6 https://t.co/D9CjMyZaF8'
933949571906056192,2017-11-24 06:45:04,b'Elon Musk\xe2\x80\x99s big battery bet in Australia pays off as Tesla beats self-imposed deadline https://t.co/YXVd8JbNdK'
933942012000325632,2017-11-24 06:15:02,"b'Under crown prince, young Saudis gain social liberties and lose political freedoms https://t.co/OAfHPvnivx'"
933938302834626560,2017-11-24 06:00:17,"b'Theresa May is likely to offer politically painful compromises to advance Brexit negotiations, writes @laurnorman\nhttps://t.co/CJmGzen3FY'"
933934475658059776,2017-11-24 05:45:05,b'The Vietnamese government is looking to strike a multibillion-dollar deal for Sabeco in the coming weeks\nhttps://t.co/uwqXyWZ5Fc'
933930733466513408,2017-11-24 05:30:13,b'Take an early look at the front page of The Wall Street Journal   \nhttps://t.co/5xQPDPcm8q https://t.co/lx0b7VE8xM'
933926920160514048,2017-11-24 05:15:03,"b'Absinthe doesn\xe2\x80\x99t make you crazy, and few are crazy about it https://t.co/oArQJZmx3x https://t.co/QAFNaFYcHO'"
933923208734142464,2017-11-24 05:00:19,"b'Bank of Mexico forecasts inflation will return to the 3% target, but some members are skeptical\nhttps://t.co/CooleoEqbP'"
933919368945328128,2017-11-24 04:45:03,"b'If you thought the diamond was already drenched in data, get ready for the robo-balls coming out of Japan\nhttps://t.co/w0RkxRVeqS'"
933915671167229952,2017-11-24 04:30:21,"b""'Excel just wasn\xe2\x80\x99t designed to do some of the heavy lifting that companies need to do in finance'\nhttps://t.co/Gu7LtfSXPN"""
933911844657467392,2017-11-24 04:15:09,b'Mitsubishi Materials shares tank after the company admitted to manipulating data on shipments for car and plane par\xe2\x80\xa6 https://t.co/jdySGBIf5h'
933908075244871680,2017-11-24 04:00:10,b'Chinese stocks open lower after Thursday\xe2\x80\x99s rout\nhttps://t.co/f4ZT8EU4Kg https://t.co/7XKMop50nO'
933904267097800704,2017-11-24 03:45:03,"b'The North Korean soldier has recovered enough to joke, watch movies and make music requests, but he remains in a fr\xe2\x80\xa6 https://t.co/JXCMl6UwEy'"
933900510289113088,2017-11-24 03:30:07,b'Brazil\xe2\x80\x99s government is scaling back a proposal to overhaul the country\xe2\x80\x99s insolvent pension system\nhttps://t.co/0FywNTw7lw'
933896721893154816,2017-11-24 03:15:04,"b'Want a loan in India? It may depend less on what you owe, and more on who you know\xe2\x80\x93\xe2\x80\x93on Facebook\nhttps://t.co/RuSXNuJRjf'"
933892975712718850,2017-11-24 03:00:10,b'Dig in: Investors are salivating over this untapped tech market \nhttps://t.co/C8jJ0lEBbS'
933889190797987841,2017-11-24 02:45:08,"b'U.S. Navy has ended search-and-rescue operations for three missing sailors, after one of its cargo planes crashed n\xe2\x80\xa6 https://t.co/CUcF4SuoKy'"
933884997232222209,2017-11-24 02:28:28,b'Elon Musk\xe2\x80\x99s big battery bet in Australia pays off as Tesla beats self-imposed deadline https://t.co/F9UPa9SiFc'
933881623036260358,2017-11-24 02:15:04,"b'Market predictions for 2017 were dead wrong. Let\xe2\x80\x99s be honest: We\xe2\x80\x99ll miss on 2018 too, writes @Jmackin2\nhttps://t.co/8PqdBH5B56'"
933881137499459584,2017-11-24 02:13:08,"b""Dramatic video shows North Korean soldier's escape\nhttps://t.co/SZw2P7blzQ"""
933877871302643712,2017-11-24 02:00:09,b'Amazon with pumpkin pie? Holiday shopping starts on your phone after dinner  https://t.co/f6qAIXxFzt https://t.co/osW6K9vi0o'
933877254437900288,2017-11-24 01:57:42,"b'Myanmar, Bangladesh have agreed on return of Rohingya refugees, but it could take years https://t.co/8MVNuCWGnp'"
933873520584609792,2017-11-24 01:42:52,"b'Notre Dame is voluntarily allowing birth-control benefits, sparking debate https://t.co/FacRpSdirc'"
933870296414769152,2017-11-24 01:30:03,"b""A staunch U.S. ally doesn't seem so sure of the status quo anymore\nhttps://t.co/4OdqV9hEmr"""
933867314889584641,2017-11-24 01:18:12,b'When is the best time of day to eat a big meal? Nutrition experts offer their strategies https://t.co/TkZKWtXPhQ'
933862823922368512,2017-11-24 01:00:22,"b'Opinion: Connect the dots to stop terror plots, writes @adam_i_klein https://t.co/1LGAWtLizB'"
933856816991174656,2017-11-24 00:36:30,b'Made-to-order pasta dishes like fettuccine Alfredo are being churned out at the speed of a burrito-slinging Chipotle https://t.co/gWYHL9i4xY'
933852902539526144,2017-11-24 00:20:56,b'A doomed hit man unburdens himself in a jailhouse interview that sheds light on the shadow battle between Russia an\xe2\x80\xa6 https://t.co/nLcYJz4sEw'
933848404517670912,2017-11-24 00:03:04,"b'If you thought baseball was already drenched in data, get ready for the robo-balls coming out of Japan. https://t.co/RCSLrHNPsI'"
933845141500067841,2017-11-23 23:50:06,b'Opinion: Remember when telephones were for talking on? writes @strawsaroyan https://t.co/p0C29gd3N1'
933841044407488512,2017-11-23 23:33:49,b'China\xe2\x80\x99s enterprise-applications market has huge potential and is devoid of a dominant player https://t.co/IuLS4xaaeF'
933837134750011393,2017-11-23 23:18:17,"b""Indian banks are peering deeply into customers' cell phones for clues on how much to lend them https://t.co/ATHNTu8jSn"""
